{
  "id": "GEO.049",
  "domain": "GEO",
  "unit": 5,
  "orderInUnit": 9,
  "standard": "GEO.CONG.1",
  "difficulty": 3,
  "prompt": "In a bridge truss, triangles $ABD$ and $CBD$ share the side $\\overline{BD}$. The builder knows $\\overline{AB} \\cong \\overline{CB}$ and $\\overline{AD} \\cong \\overline{CD}$, and nothing about the angles. Which criterion proves $\\triangle ABD \\cong \\triangle CBD$? Answer with three letters.",
  "answerType": "short-text",
  "primaryAnswer": "SSS",
  "alternativeAnswers": [
    "sss",
    "S.S.S.",
    "side side side",
    "side-side-side"
  ],
  "acceptanceMode": "normalized",
  "hint": "You are given two pairs of congruent sides. Is there a third pair hiding in the picture?",
  "hints": [
    {
      "level": "nudge",
      "text": "You are given two pairs of congruent sides. Is there a third pair hiding in the picture?"
    },
    {
      "level": "nudge",
      "title": "🪜 Try a simpler one",
      "text": "Count the pairs on a smaller version: with only $\\overline{AB} \\cong \\overline{CB}$ plus the shared $\\overline{BD}$ you have just two side pairs — not enough. The second given pair makes three sides and zero angles."
    },
    {
      "level": "guide",
      "text": "The shared side $\\overline{BD}$ is congruent to itself by the Reflexive Property — that is your third pair."
    },
    {
      "level": "reveal",
      "text": "Three pairs of sides and no angles: SSS."
    }
  ],
  "explanation": [
    "Two pairs of congruent sides are given: $\\overline{AB} \\cong \\overline{CB}$ and $\\overline{AD} \\cong \\overline{CD}$.",
    "The shared side supplies a third pair: $\\overline{BD} \\cong \\overline{BD}$ by the Reflexive Property.",
    "That is three pairs of corresponding sides and no angle information, so the criterion is SSS."
  ],
  "alternativeExplanations": [
    {
      "title": "Always hunt for the free part",
      "steps": [
        "Whenever two triangles share a side or an angle, that shared part is a free congruence, courtesy of the Reflexive Property.",
        "Mark it in the figure before you count. Here it turns \"two sides\" into the three you need."
      ]
    },
    {
      "title": "⚠️ The trap here",
      "steps": [
        "The trap answer is SAS. Students see two sides and assume the angle at $B$ or $D$ is \"obviously\" congruent — but no angle was given or marked, and looking congruent proves nothing.",
        "Only count parts you were GIVEN or can justify with a property. Given sides, given sides, reflexive side: that is SSS."
      ]
    }
  ],
  "tags": [
    "congruence",
    "SSS",
    "reflexive-property",
    "shared-side"
  ],
  "estimatedSeconds": 70,
  "diagram": {
    "kind": "inline-svg",
    "svg": "<svg xmlns=\"http://www.w3.org/2000/svg\" viewBox=\"0 0 360 230\" role=\"img\" font-family=\"Nunito, ui-rounded, system-ui, sans-serif\" stroke-linecap=\"round\" stroke-linejoin=\"round\"><polygon points=\"60,180 180,60 180,180\" fill=\"#F59E0B1e\" stroke=\"#F59E0B\" stroke-width=\"2.8\" stroke-linejoin=\"round\"/><polygon points=\"300,180 180,60 180,180\" fill=\"#0EA5E91e\" stroke=\"#0EA5E9\" stroke-width=\"2.8\" stroke-linejoin=\"round\"/><line x1=\"180\" y1=\"60\" x2=\"180\" y2=\"180\" stroke=\"#8B5CF6\" stroke-width=\"3.4\"/><text x=\"194\" y=\"124\" font-size=\"13\" font-weight=\"700\" fill=\"#8B5CF6\" text-anchor=\"start\">BD</text><text x=\"54\" y=\"198\" font-size=\"13\" font-weight=\"700\" fill=\"currentColor\" text-anchor=\"middle\">A</text><text x=\"306\" y=\"198\" font-size=\"13\" font-weight=\"700\" fill=\"currentColor\" text-anchor=\"middle\">C</text><text x=\"180\" y=\"46\" font-size=\"13\" font-weight=\"700\" fill=\"currentColor\" text-anchor=\"middle\">B</text><text x=\"180\" y=\"200\" font-size=\"13\" font-weight=\"700\" fill=\"currentColor\" text-anchor=\"middle\">D</text><line x1=\"123.5\" y1=\"123.5\" x2=\"116.5\" y2=\"116.5\" stroke=\"#10B981\" stroke-width=\"2.2\"/><line x1=\"243.5\" y1=\"116.5\" x2=\"236.5\" y2=\"123.5\" stroke=\"#10B981\" stroke-width=\"2.2\"/><line x1=\"120\" y1=\"185\" x2=\"120\" y2=\"175\" stroke=\"#F43F5E\" stroke-width=\"2.2\"/><line x1=\"240\" y1=\"185\" x2=\"240\" y2=\"175\" stroke=\"#F43F5E\" stroke-width=\"2.2\"/><line x1=\"126\" y1=\"185\" x2=\"126\" y2=\"175\" stroke=\"#F43F5E\" stroke-width=\"2.2\"/><line x1=\"246\" y1=\"185\" x2=\"246\" y2=\"175\" stroke=\"#F43F5E\" stroke-width=\"2.2\"/><text x=\"180\" y=\"30\" font-size=\"12\" font-weight=\"700\" fill=\"#8B5CF6\" text-anchor=\"middle\">AB = CB, AD = CD, and BD is in both</text></svg>",
    "alt": "Two triangles meeting along a shared side BD, with matching sides tick-marked"
  }
}
