{
  "id": "PC.094",
  "domain": "PC",
  "unit": 10,
  "orderInUnit": 4,
  "standard": "PC.TRIG.B.1",
  "difficulty": 2,
  "prompt": "What is the PERIOD of $y = \\sin(2x)$, in degrees?",
  "answerType": "numeric",
  "primaryAnswer": "180",
  "alternativeAnswers": [],
  "acceptanceMode": "normalized",
  "hint": "Period $= 360^\\circ \\div b$, where $b$ is the number in FRONT of $x$ inside the sine.",
  "hints": [
    {
      "level": "nudge",
      "text": "Period $= 360^\\circ \\div b$, where $b$ is the number in FRONT of $x$ inside the sine."
    },
    {
      "level": "guide",
      "text": "Here $b = 2$, so the period is $360 \\div 2$."
    },
    {
      "level": "reveal",
      "text": "$360 \\div 2 = 180$, so the period is $180^\\circ$."
    }
  ],
  "explanation": [
    "The period is how far along $x$ you travel before one full wave finishes and starts over.",
    "Plain $\\sin(x)$ takes $360^\\circ$. The $2$ inside makes $x$ count DOUBLE-time, so the wave finishes twice as fast.",
    "Period $= 360 \\div 2 = 180^\\circ$."
  ],
  "alternativeExplanations": [
    {
      "title": "Follow the inside",
      "steps": [
        "One full wave happens while the inside of the sine runs from 0 to 360.",
        "The inside is 2x, so 2x = 360 means x = 180. The x-trip is only 180°."
      ]
    },
    {
      "title": "Squeeze the jump rope",
      "steps": [
        "A bigger number in front of x squeezes the wave sideways, packing more waves into the same space.",
        "b = 2 packs 2 whole waves into 360°, so each one is 360 ÷ 2 = 180° wide."
      ]
    }
  ],
  "tags": [
    "period"
  ],
  "estimatedSeconds": 50,
  "diagram": {
    "kind": "inline-svg",
    "svg": "<svg xmlns=\"http://www.w3.org/2000/svg\" viewBox=\"0 0 360 236\" role=\"img\" font-family=\"Nunito, ui-rounded, system-ui, sans-serif\" stroke-linecap=\"round\" stroke-linejoin=\"round\"><line opacity=\"0.55\" x1=\"36\" y1=\"113\" x2=\"354\" y2=\"113\" stroke=\"currentColor\" stroke-width=\"1.5\"/><line opacity=\"0.55\" x1=\"346.1\" y1=\"117.3\" x2=\"354\" y2=\"113\" stroke=\"currentColor\" stroke-width=\"1.5\"/><line opacity=\"0.55\" x1=\"346.1\" y1=\"108.7\" x2=\"354\" y2=\"113\" stroke=\"currentColor\" stroke-width=\"1.5\"/><line opacity=\"0.55\" x1=\"44\" y1=\"198\" x2=\"44\" y2=\"26\" stroke=\"currentColor\" stroke-width=\"1.5\"/><line opacity=\"0.55\" x1=\"48.3\" y1=\"33.9\" x2=\"44\" y2=\"26\" stroke=\"currentColor\" stroke-width=\"1.5\"/><line opacity=\"0.55\" x1=\"39.7\" y1=\"33.9\" x2=\"44\" y2=\"26\" stroke=\"currentColor\" stroke-width=\"1.5\"/><line x1=\"118.5\" y1=\"109\" x2=\"118.5\" y2=\"117\" stroke=\"currentColor\" stroke-width=\"1.2\" opacity=\"0.6\"/><text x=\"118.5\" y=\"210\" font-size=\"11\" font-weight=\"700\" fill=\"currentColor\" text-anchor=\"middle\" opacity=\"0.75\">90°</text><line x1=\"193\" y1=\"109\" x2=\"193\" y2=\"117\" stroke=\"currentColor\" stroke-width=\"1.2\" opacity=\"0.6\"/><text x=\"193\" y=\"210\" font-size=\"11\" font-weight=\"700\" fill=\"currentColor\" text-anchor=\"middle\" opacity=\"0.75\">180°</text><line x1=\"267.5\" y1=\"109\" x2=\"267.5\" y2=\"117\" stroke=\"currentColor\" stroke-width=\"1.2\" opacity=\"0.6\"/><text x=\"267.5\" y=\"210\" font-size=\"11\" font-weight=\"700\" fill=\"currentColor\" text-anchor=\"middle\" opacity=\"0.75\">270°</text><line x1=\"342\" y1=\"109\" x2=\"342\" y2=\"117\" stroke=\"currentColor\" stroke-width=\"1.2\" opacity=\"0.6\"/><text x=\"342\" y=\"210\" font-size=\"11\" font-weight=\"700\" fill=\"currentColor\" text-anchor=\"middle\" opacity=\"0.75\">360°</text><line x1=\"40\" y1=\"54.9\" x2=\"48\" y2=\"54.9\" stroke=\"currentColor\" stroke-width=\"1.2\" opacity=\"0.6\"/><text x=\"36\" y=\"58.9\" font-size=\"11\" font-weight=\"700\" fill=\"currentColor\" text-anchor=\"end\" opacity=\"0.75\">1</text><line x1=\"40\" y1=\"113\" x2=\"48\" y2=\"113\" stroke=\"currentColor\" stroke-width=\"1.2\" opacity=\"0.6\"/><text x=\"36\" y=\"117\" font-size=\"11\" font-weight=\"700\" fill=\"currentColor\" text-anchor=\"end\" opacity=\"0.75\">0</text><line x1=\"40\" y1=\"171.1\" x2=\"48\" y2=\"171.1\" stroke=\"currentColor\" stroke-width=\"1.2\" opacity=\"0.6\"/><text x=\"36\" y=\"175.1\" font-size=\"11\" font-weight=\"700\" fill=\"currentColor\" text-anchor=\"end\" opacity=\"0.75\">-1</text><path d=\"M 44 113 L 45.1 110.2 L 46.3 107.4 L 47.4 104.6 L 48.6 101.8 L 49.7 99.1 L 50.9 96.4 L 52 93.7 L 53.2 91.1 L 54.3 88.5 L 55.5 86 L 56.6 83.6 L 57.8 81.2 L 58.9 78.9 L 60 76.6 L 61.2 74.5 L 62.3 72.4 L 63.5 70.5 L 64.6 68.6 L 65.8 66.8 L 66.9 65.2 L 68.1 63.7 L 69.2 62.2 L 70.4 60.9 L 71.5 59.7 L 72.7 58.7 L 73.8 57.8 L 74.9 57 L 76.1 56.3 L 77.2 55.7 L 78.4 55.3 L 79.5 55.1 L 80.7 54.9 L 81.8 54.9 L 83 55.1 L 84.1 55.3 L 85.3 55.7 L 86.4 56.3 L 87.6 57 L 88.7 57.8 L 89.8 58.7 L 91 59.7 L 92.1 60.9 L 93.3 62.2 L 94.4 63.7 L 95.6 65.2 L 96.7 66.8 L 97.9 68.6 L 99 70.5 L 100.2 72.4 L 101.3 74.5 L 102.5 76.6 L 103.6 78.9 L 104.7 81.2 L 105.9 83.6 L 107 86 L 108.2 88.5 L 109.3 91.1 L 110.5 93.7 L 111.6 96.4 L 112.8 99.1 L 113.9 101.8 L 115.1 104.6 L 116.2 107.4 L 117.4 110.2 L 118.5 113 L 119.6 115.8 L 120.8 118.6 L 121.9 121.4 L 123.1 124.2 L 124.2 126.9 L 125.4 129.6 L 126.5 132.3 L 127.7 134.9 L 128.8 137.5 L 130 140 L 131.1 142.4 L 132.3 144.8 L 133.4 147.1 L 134.5 149.4 L 135.7 151.5 L 136.8 153.6 L 138 155.5 L 139.1 157.4 L 140.3 159.2 L 141.4 160.8 L 142.6 162.3 L 143.7 163.8 L 144.9 165.1 L 146 166.3 L 147.2 167.3 L 148.3 168.2 L 149.4 169 L 150.6 169.7 L 151.7 170.3 L 152.9 170.7 L 154 170.9 L 155.2 171.1 L 156.3 171.1 L 157.5 170.9 L 158.6 170.7 L 159.8 170.3 L 160.9 169.7 L 162.1 169 L 163.2 168.2 L 164.3 167.3 L 165.5 166.3 L 166.6 165.1 L 167.8 163.8 L 168.9 162.3 L 170.1 160.8 L 171.2 159.2 L 172.4 157.4 L 173.5 155.5 L 174.7 153.6 L 175.8 151.5 L 177 149.4 L 178.1 147.1 L 179.2 144.8 L 180.4 142.4 L 181.5 140 L 182.7 137.5 L 183.8 134.9 L 185 132.3 L 186.1 129.6 L 187.3 126.9 L 188.4 124.2 L 189.6 121.4 L 190.7 118.6 L 191.9 115.8 L 193 113 L 194.1 110.2 L 195.3 107.4 L 196.4 104.6 L 197.6 101.8 L 198.7 99.1 L 199.9 96.4 L 201 93.7 L 202.2 91.1 L 203.3 88.5 L 204.5 86 L 205.6 83.6 L 206.8 81.2 L 207.9 78.9 L 209 76.6 L 210.2 74.5 L 211.3 72.4 L 212.5 70.5 L 213.6 68.6 L 214.8 66.8 L 215.9 65.2 L 217.1 63.7 L 218.2 62.2 L 219.4 60.9 L 220.5 59.7 L 221.7 58.7 L 222.8 57.8 L 223.9 57 L 225.1 56.3 L 226.2 55.7 L 227.4 55.3 L 228.5 55.1 L 229.7 54.9 L 230.8 54.9 L 232 55.1 L 233.1 55.3 L 234.3 55.7 L 235.4 56.3 L 236.6 57 L 237.7 57.8 L 238.8 58.7 L 240 59.7 L 241.1 60.9 L 242.3 62.2 L 243.4 63.7 L 244.6 65.2 L 245.7 66.8 L 246.9 68.6 L 248 70.5 L 249.2 72.4 L 250.3 74.5 L 251.5 76.6 L 252.6 78.9 L 253.7 81.2 L 254.9 83.6 L 256 86 L 257.2 88.5 L 258.3 91.1 L 259.5 93.7 L 260.6 96.4 L 261.8 99.1 L 262.9 101.8 L 264.1 104.6 L 265.2 107.4 L 266.4 110.2 L 267.5 113 L 268.6 115.8 L 269.8 118.6 L 270.9 121.4 L 272.1 124.2 L 273.2 126.9 L 274.4 129.6 L 275.5 132.3 L 276.7 134.9 L 277.8 137.5 L 279 140 L 280.1 142.4 L 281.3 144.8 L 282.4 147.1 L 283.5 149.4 L 284.7 151.5 L 285.8 153.6 L 287 155.5 L 288.1 157.4 L 289.3 159.2 L 290.4 160.8 L 291.6 162.3 L 292.7 163.8 L 293.9 165.1 L 295 166.3 L 296.2 167.3 L 297.3 168.2 L 298.4 169 L 299.6 169.7 L 300.7 170.3 L 301.9 170.7 L 303 170.9 L 304.2 171.1 L 305.3 171.1 L 306.5 170.9 L 307.6 170.7 L 308.8 170.3 L 309.9 169.7 L 311.1 169 L 312.2 168.2 L 313.3 167.3 L 314.5 166.3 L 315.6 165.1 L 316.8 163.8 L 317.9 162.3 L 319.1 160.8 L 320.2 159.2 L 321.4 157.4 L 322.5 155.5 L 323.7 153.6 L 324.8 151.5 L 326 149.4 L 327.1 147.1 L 328.2 144.8 L 329.4 142.4 L 330.5 140 L 331.7 137.5 L 332.8 134.9 L 334 132.3 L 335.1 129.6 L 336.3 126.9 L 337.4 124.2 L 338.6 121.4 L 339.7 118.6 L 340.9 115.8 L 342 113\" fill=\"none\" stroke=\"#F59E0B\" stroke-width=\"2.6\"/><text x=\"340\" y=\"14\" font-size=\"12\" font-weight=\"700\" fill=\"#F59E0B\" text-anchor=\"end\">y = sin 2x</text><line x1=\"44\" y1=\"40\" x2=\"193\" y2=\"40\" stroke=\"#8B5CF6\" stroke-width=\"2.2\"/><line x1=\"44\" y1=\"35\" x2=\"44\" y2=\"45\" stroke=\"#8B5CF6\" stroke-width=\"2.2\"/><line x1=\"193\" y1=\"35\" x2=\"193\" y2=\"45\" stroke=\"#8B5CF6\" stroke-width=\"2.2\"/><text x=\"118.5\" y=\"50\" font-size=\"12\" font-weight=\"700\" fill=\"#8B5CF6\" text-anchor=\"middle\">period = ?</text></svg>",
    "alt": "Graph of y = sin 2x, with period = ? marked"
  }
}
