{
  "id": "PC.093",
  "domain": "PC",
  "unit": 10,
  "orderInUnit": 3,
  "standard": "PC.TRIG.B.1",
  "difficulty": 1,
  "prompt": "A Ferris wheel seat follows $h = 18\\sin(x) + 22$ metres. What is the AMPLITUDE?",
  "answerType": "numeric",
  "primaryAnswer": "18",
  "alternativeAnswers": [],
  "acceptanceMode": "normalized",
  "hint": "The amplitude is the number multiplying the sine.",
  "hints": [
    {
      "level": "nudge",
      "text": "The amplitude is the number multiplying the sine."
    },
    {
      "level": "guide",
      "text": "In $h = a\\sin(x) + k$, the amplitude is $a$ and the midline is $k$."
    },
    {
      "level": "reveal",
      "text": "The amplitude is $18$ metres."
    }
  ],
  "explanation": [
    "Compare to $h = a\\sin(x) + k$.",
    "Here $a = 18$ and the midline $k = 22$.",
    "The seat rises $18$ m above and falls $18$ m below the $22$ m midline, so the amplitude is $18$."
  ],
  "alternativeExplanations": [
    {
      "title": "From the highest and lowest points",
      "steps": [
        "Highest is 22 + 18 = 40 m; lowest is 22 − 18 = 4 m.",
        "Amplitude is HALF the gap: (40 − 4) ÷ 2 = 36 ÷ 2 = 18 m."
      ]
    },
    {
      "title": "Picture the wheel",
      "steps": [
        "The centre of the wheel sits 22 m up — that is the midline.",
        "The wheel carries you 18 m above and 18 m below that centre, so the amplitude IS the radius: 18 m."
      ]
    }
  ],
  "tags": [
    "amplitude",
    "word-problem"
  ],
  "estimatedSeconds": 40,
  "diagram": {
    "kind": "inline-svg",
    "svg": "<svg xmlns=\"http://www.w3.org/2000/svg\" viewBox=\"0 0 360 236\" role=\"img\" font-family=\"Nunito, ui-rounded, system-ui, sans-serif\" stroke-linecap=\"round\" stroke-linejoin=\"round\"><line opacity=\"0.55\" x1=\"36\" y1=\"184\" x2=\"354\" y2=\"184\" stroke=\"currentColor\" stroke-width=\"1.5\"/><line opacity=\"0.55\" x1=\"346.1\" y1=\"188.3\" x2=\"354\" y2=\"184\" stroke=\"currentColor\" stroke-width=\"1.5\"/><line opacity=\"0.55\" x1=\"346.1\" y1=\"179.7\" x2=\"354\" y2=\"184\" stroke=\"currentColor\" stroke-width=\"1.5\"/><line opacity=\"0.55\" x1=\"44\" y1=\"198\" x2=\"44\" y2=\"26\" stroke=\"currentColor\" stroke-width=\"1.5\"/><line opacity=\"0.55\" x1=\"48.3\" y1=\"33.9\" x2=\"44\" y2=\"26\" stroke=\"currentColor\" stroke-width=\"1.5\"/><line opacity=\"0.55\" x1=\"39.7\" y1=\"33.9\" x2=\"44\" y2=\"26\" stroke=\"currentColor\" stroke-width=\"1.5\"/><line x1=\"118.5\" y1=\"180\" x2=\"118.5\" y2=\"188\" stroke=\"currentColor\" stroke-width=\"1.2\" opacity=\"0.6\"/><text x=\"118.5\" y=\"210\" font-size=\"11\" font-weight=\"700\" fill=\"currentColor\" text-anchor=\"middle\" opacity=\"0.75\">90°</text><line x1=\"193\" y1=\"180\" x2=\"193\" y2=\"188\" stroke=\"currentColor\" stroke-width=\"1.2\" opacity=\"0.6\"/><text x=\"193\" y=\"210\" font-size=\"11\" font-weight=\"700\" fill=\"currentColor\" text-anchor=\"middle\" opacity=\"0.75\">180°</text><line x1=\"267.5\" y1=\"180\" x2=\"267.5\" y2=\"188\" stroke=\"currentColor\" stroke-width=\"1.2\" opacity=\"0.6\"/><text x=\"267.5\" y=\"210\" font-size=\"11\" font-weight=\"700\" fill=\"currentColor\" text-anchor=\"middle\" opacity=\"0.75\">270°</text><line x1=\"342\" y1=\"180\" x2=\"342\" y2=\"188\" stroke=\"currentColor\" stroke-width=\"1.2\" opacity=\"0.6\"/><text x=\"342\" y=\"210\" font-size=\"11\" font-weight=\"700\" fill=\"currentColor\" text-anchor=\"middle\" opacity=\"0.75\">360°</text><line x1=\"40\" y1=\"54.9\" x2=\"48\" y2=\"54.9\" stroke=\"currentColor\" stroke-width=\"1.2\" opacity=\"0.6\"/><text x=\"36\" y=\"58.9\" font-size=\"11\" font-weight=\"700\" fill=\"currentColor\" text-anchor=\"end\" opacity=\"0.75\">40</text><line x1=\"40\" y1=\"113\" x2=\"48\" y2=\"113\" stroke=\"currentColor\" stroke-width=\"1.2\" opacity=\"0.6\"/><text x=\"36\" y=\"117\" font-size=\"11\" font-weight=\"700\" fill=\"currentColor\" text-anchor=\"end\" opacity=\"0.75\">22</text><line x1=\"40\" y1=\"171.1\" x2=\"48\" y2=\"171.1\" stroke=\"currentColor\" stroke-width=\"1.2\" opacity=\"0.6\"/><text x=\"36\" y=\"175.1\" font-size=\"11\" font-weight=\"700\" fill=\"currentColor\" text-anchor=\"end\" opacity=\"0.75\">4</text><path d=\"M 44 113 L 45.1 111.6 L 46.3 110.2 L 47.4 108.8 L 48.6 107.4 L 49.7 106 L 50.9 104.6 L 52 103.2 L 53.2 101.8 L 54.3 100.5 L 55.5 99.1 L 56.6 97.7 L 57.8 96.4 L 58.9 95 L 60 93.7 L 61.2 92.4 L 62.3 91.1 L 63.5 89.8 L 64.6 88.5 L 65.8 87.3 L 66.9 86 L 68.1 84.8 L 69.2 83.6 L 70.4 82.4 L 71.5 81.2 L 72.7 80 L 73.8 78.9 L 74.9 77.7 L 76.1 76.6 L 77.2 75.5 L 78.4 74.5 L 79.5 73.4 L 80.7 72.4 L 81.8 71.4 L 83 70.5 L 84.1 69.5 L 85.3 68.6 L 86.4 67.7 L 87.6 66.8 L 88.7 66 L 89.8 65.2 L 91 64.4 L 92.1 63.7 L 93.3 62.9 L 94.4 62.2 L 95.6 61.6 L 96.7 60.9 L 97.9 60.3 L 99 59.7 L 100.2 59.2 L 101.3 58.7 L 102.5 58.2 L 103.6 57.8 L 104.7 57.3 L 105.9 57 L 107 56.6 L 108.2 56.3 L 109.3 56 L 110.5 55.7 L 111.6 55.5 L 112.8 55.3 L 113.9 55.2 L 115.1 55.1 L 116.2 55 L 117.4 54.9 L 118.5 54.9 L 119.6 54.9 L 120.8 55 L 121.9 55.1 L 123.1 55.2 L 124.2 55.3 L 125.4 55.5 L 126.5 55.7 L 127.7 56 L 128.8 56.3 L 130 56.6 L 131.1 57 L 132.3 57.3 L 133.4 57.8 L 134.5 58.2 L 135.7 58.7 L 136.8 59.2 L 138 59.7 L 139.1 60.3 L 140.3 60.9 L 141.4 61.6 L 142.6 62.2 L 143.7 62.9 L 144.9 63.7 L 146 64.4 L 147.2 65.2 L 148.3 66 L 149.4 66.8 L 150.6 67.7 L 151.7 68.6 L 152.9 69.5 L 154 70.5 L 155.2 71.4 L 156.3 72.4 L 157.5 73.4 L 158.6 74.5 L 159.8 75.5 L 160.9 76.6 L 162.1 77.7 L 163.2 78.9 L 164.3 80 L 165.5 81.2 L 166.6 82.4 L 167.8 83.6 L 168.9 84.8 L 170.1 86 L 171.2 87.3 L 172.4 88.5 L 173.5 89.8 L 174.7 91.1 L 175.8 92.4 L 177 93.7 L 178.1 95 L 179.2 96.4 L 180.4 97.7 L 181.5 99.1 L 182.7 100.5 L 183.8 101.8 L 185 103.2 L 186.1 104.6 L 187.3 106 L 188.4 107.4 L 189.6 108.8 L 190.7 110.2 L 191.9 111.6 L 193 113 L 194.1 114.4 L 195.3 115.8 L 196.4 117.2 L 197.6 118.6 L 198.7 120 L 199.9 121.4 L 201 122.8 L 202.2 124.2 L 203.3 125.5 L 204.5 126.9 L 205.6 128.3 L 206.8 129.6 L 207.9 131 L 209 132.3 L 210.2 133.6 L 211.3 134.9 L 212.5 136.2 L 213.6 137.5 L 214.8 138.7 L 215.9 140 L 217.1 141.2 L 218.2 142.4 L 219.4 143.6 L 220.5 144.8 L 221.7 146 L 222.8 147.1 L 223.9 148.3 L 225.1 149.4 L 226.2 150.5 L 227.4 151.5 L 228.5 152.6 L 229.7 153.6 L 230.8 154.6 L 232 155.5 L 233.1 156.5 L 234.3 157.4 L 235.4 158.3 L 236.6 159.2 L 237.7 160 L 238.8 160.8 L 240 161.6 L 241.1 162.3 L 242.3 163.1 L 243.4 163.8 L 244.6 164.4 L 245.7 165.1 L 246.9 165.7 L 248 166.3 L 249.2 166.8 L 250.3 167.3 L 251.5 167.8 L 252.6 168.2 L 253.7 168.7 L 254.9 169 L 256 169.4 L 257.2 169.7 L 258.3 170 L 259.5 170.3 L 260.6 170.5 L 261.8 170.7 L 262.9 170.8 L 264.1 170.9 L 265.2 171 L 266.4 171.1 L 267.5 171.1 L 268.6 171.1 L 269.8 171 L 270.9 170.9 L 272.1 170.8 L 273.2 170.7 L 274.4 170.5 L 275.5 170.3 L 276.7 170 L 277.8 169.7 L 279 169.4 L 280.1 169 L 281.3 168.7 L 282.4 168.2 L 283.5 167.8 L 284.7 167.3 L 285.8 166.8 L 287 166.3 L 288.1 165.7 L 289.3 165.1 L 290.4 164.4 L 291.6 163.8 L 292.7 163.1 L 293.9 162.3 L 295 161.6 L 296.2 160.8 L 297.3 160 L 298.4 159.2 L 299.6 158.3 L 300.7 157.4 L 301.9 156.5 L 303 155.5 L 304.2 154.6 L 305.3 153.6 L 306.5 152.6 L 307.6 151.5 L 308.8 150.5 L 309.9 149.4 L 311.1 148.3 L 312.2 147.1 L 313.3 146 L 314.5 144.8 L 315.6 143.6 L 316.8 142.4 L 317.9 141.2 L 319.1 140 L 320.2 138.7 L 321.4 137.5 L 322.5 136.2 L 323.7 134.9 L 324.8 133.6 L 326 132.3 L 327.1 131 L 328.2 129.6 L 329.4 128.3 L 330.5 126.9 L 331.7 125.5 L 332.8 124.2 L 334 122.8 L 335.1 121.4 L 336.3 120 L 337.4 118.6 L 338.6 117.2 L 339.7 115.8 L 340.9 114.4 L 342 113\" fill=\"none\" stroke=\"#F59E0B\" stroke-width=\"2.6\"/><text x=\"340\" y=\"14\" font-size=\"12\" font-weight=\"700\" fill=\"#F59E0B\" text-anchor=\"end\">h = 18 sin x + 22</text><line x1=\"44\" y1=\"113\" x2=\"342\" y2=\"113\" stroke=\"#10B981\" stroke-width=\"1.8\" stroke-dasharray=\"6 4\"/><text x=\"340\" y=\"107\" font-size=\"12\" font-weight=\"700\" fill=\"#10B981\" text-anchor=\"end\">y = 22</text><line x1=\"267.5\" y1=\"113\" x2=\"267.5\" y2=\"171.1\" stroke=\"#0EA5E9\" stroke-width=\"2.2\"/><line x1=\"262.5\" y1=\"171.1\" x2=\"272.5\" y2=\"171.1\" stroke=\"#0EA5E9\" stroke-width=\"2.2\"/><line x1=\"262.5\" y1=\"113\" x2=\"272.5\" y2=\"113\" stroke=\"#0EA5E9\" stroke-width=\"2.2\"/><text x=\"276.5\" y=\"146\" font-size=\"12\" font-weight=\"700\" fill=\"#0EA5E9\" text-anchor=\"start\">?</text></svg>",
    "alt": "Graph of h = 18 sin x + 22, with y = 22, ? marked"
  }
}
