{
  "id": "6.G.051",
  "domain": "6.G",
  "unit": 6,
  "orderInUnit": 1,
  "standard": "6.G.A.1",
  "difficulty": 1,
  "prompt": "A room is $12 \\times 10$ ft. Find its area.",
  "answerType": "numeric",
  "primaryAnswer": "120",
  "alternativeAnswers": [
    "120 sq ft"
  ],
  "acceptanceMode": "normalized",
  "hint": "$A = l \\times w$.",
  "hints": [
    {
      "level": "nudge",
      "text": "$A = l \\times w$."
    },
    {
      "level": "guide",
      "text": "$12 \\times 10$."
    },
    {
      "level": "reveal",
      "text": "$120$."
    }
  ],
  "explanation": [
    "$A = 12 \\times 10 = 120$ sq ft."
  ],
  "tags": [
    "area",
    "word"
  ],
  "estimatedSeconds": 30,
  "diagram": {
    "kind": "inline-svg",
    "svg": "<svg xmlns=\"http://www.w3.org/2000/svg\" viewBox=\"0 0 360 240\" role=\"img\" font-family=\"Nunito, ui-rounded, system-ui, sans-serif\" stroke-linecap=\"round\" stroke-linejoin=\"round\"><polygon points=\"90,200 270,200 270,50 90,50\" fill=\"#F59E0B18\" stroke=\"#F59E0B\" stroke-width=\"3\" stroke-linejoin=\"round\"/><text x=\"180\" y=\"220\" font-size=\"13\" font-weight=\"700\" fill=\"currentColor\" text-anchor=\"middle\">12 ft</text><text x=\"80\" y=\"129\" font-size=\"13\" font-weight=\"700\" fill=\"currentColor\" text-anchor=\"end\">10 ft</text><text x=\"180\" y=\"36\" font-size=\"13\" font-weight=\"700\" fill=\"#F43F5E\" text-anchor=\"middle\">area = ?</text></svg>",
    "alt": "A rectangle 12 ft by 10 ft"
  }
}
