{
  "id": "GEO.082",
  "domain": "GEO",
  "unit": 9,
  "orderInUnit": 2,
  "standard": "GEO.RT.2",
  "difficulty": 1,
  "prompt": "In a right triangle, the side adjacent to $\\angle P$ measures $24$ and the hypotenuse measures $25$. What is $\\cos P$? Give a decimal.",
  "answerType": "numeric",
  "primaryAnswer": "0.96",
  "alternativeAnswers": [
    "24/25",
    ".96"
  ],
  "acceptanceMode": "normalized",
  "hint": "CAH: **C**osine is **A**djacent over **H**ypotenuse.",
  "hints": [
    {
      "level": "nudge",
      "text": "CAH: **C**osine is **A**djacent over **H**ypotenuse."
    },
    {
      "level": "guide",
      "text": "Adjacent is $24$, hypotenuse is $25$, so $\\cos P = \\frac{24}{25}$."
    },
    {
      "level": "reveal",
      "text": "$24 \\div 25 = 0.96$."
    }
  ],
  "explanation": [
    "Cosine is the adjacent leg over the hypotenuse.",
    "Substitute: $\\cos P = \\frac{24}{25}$.",
    "As a decimal that is $0.96$."
  ],
  "alternativeExplanations": [
    {
      "title": "What 0.96 tells you",
      "steps": [
        "A cosine that close to $1$ means the adjacent leg is nearly as long as the hypotenuse.",
        "That happens when the angle is small and skinny — this angle is only about $16^\\circ$."
      ]
    }
  ],
  "tags": [
    "soh-cah-toa",
    "cosine"
  ],
  "estimatedSeconds": 35,
  "diagram": {
    "kind": "inline-svg",
    "svg": "<svg xmlns=\"http://www.w3.org/2000/svg\" viewBox=\"0 0 360 250\" role=\"img\" font-family=\"Nunito, ui-rounded, system-ui, sans-serif\" stroke-linecap=\"round\" stroke-linejoin=\"round\"><polygon points=\"80,195 295,132.3 295,195\" fill=\"#F59E0B22\" stroke=\"#F59E0B\" stroke-width=\"3\" stroke-linejoin=\"round\"/><path d=\"M 281 195 L 281 181 L 295 181\" fill=\"none\" stroke=\"currentColor\" stroke-width=\"1.8\"/><path d=\"M 110 195 A 30 30 0 0 0 108.8 186.6\" fill=\"none\" stroke=\"#0EA5E9\" stroke-width=\"2.5\"/><text x=\"137.4\" y=\"176.6\" font-size=\"14\" font-weight=\"700\" fill=\"#0EA5E9\" text-anchor=\"start\">P</text><text x=\"187.5\" y=\"215\" font-size=\"14\" font-weight=\"700\" fill=\"currentColor\" text-anchor=\"middle\">24</text><text x=\"183\" y=\"153.3\" font-size=\"14\" font-weight=\"700\" fill=\"currentColor\" text-anchor=\"middle\">25</text></svg>",
    "alt": "A right triangle with adjacent 24, hypotenuse 25"
  }
}
