{
  "id": "GEO.050",
  "domain": "GEO",
  "unit": 5,
  "orderInUnit": 10,
  "standard": "GEO.CONG.1",
  "difficulty": 3,
  "prompt": "Two triangular sail panels have two pairs of congruent sides and one pair of congruent angles, but the congruent angle is NOT between the two congruent sides, and the triangles are not right triangles. Which congruence criterion proves them congruent?",
  "answerType": "multiple-choice",
  "choices": [
    {
      "id": "A",
      "label": "None of these — two sides and a non-included angle does not guarantee congruence",
      "correct": true
    },
    {
      "id": "B",
      "label": "SAS",
      "correct": false
    },
    {
      "id": "C",
      "label": "SSA, which works just like SAS",
      "correct": false
    },
    {
      "id": "D",
      "label": "HL",
      "correct": false
    }
  ],
  "primaryAnswer": "A",
  "alternativeAnswers": [],
  "acceptanceMode": "normalized",
  "hint": "For SAS, the angle must be BETWEEN the two sides. Here it is not.",
  "hints": [
    {
      "level": "nudge",
      "text": "For SAS, the angle must be BETWEEN the two sides. Here it is not."
    },
    {
      "level": "nudge",
      "title": "🪜 Try a simpler one",
      "text": "Test the rule on the easy case: two sides with the angle BETWEEN them is SAS, which does work. Slide that angle outside the two sides and the arrangement becomes SSA — check whether SSA is on the valid list."
    },
    {
      "level": "guide",
      "text": "The valid list is SSS, SAS, ASA, AAS, and HL for right triangles. Is SSA on it?"
    },
    {
      "level": "reveal",
      "text": "SSA is not a congruence criterion, so none of these applies."
    }
  ],
  "explanation": [
    "The criteria that work are SSS, SAS, ASA, AAS, and HL (right triangles only).",
    "SAS requires the angle to be INCLUDED between the two sides; here it is not, so this arrangement is SSA.",
    "SSA is famously unreliable: two different triangles can share the same two sides and non-included angle — the swinging side can land in two different spots.",
    "HL does not apply either, because that shortcut is only for right triangles."
  ],
  "alternativeExplanations": [
    {
      "title": "Picture the swinging side",
      "steps": [
        "Draw the angle, mark one side along it, then swing the second side from the far end like a compass needle.",
        "That arc can cross the other ray in TWO places, giving two different triangles from the same SSA data. Two possible triangles means no guarantee."
      ]
    },
    {
      "title": "⚠️ The trap here",
      "steps": [
        "The trap is choosing SAS — the parts are a side, a side, and an angle, so the letters feel close enough.",
        "Check the word \"included\" every time. If the angle is not sandwiched between the two sides, you have SSA, not SAS, and SSA proves nothing (unless the triangles are right, where it becomes HL)."
      ]
    }
  ],
  "tags": [
    "congruence",
    "SSA",
    "SAS",
    "misconception"
  ],
  "estimatedSeconds": 80,
  "diagram": {
    "kind": "inline-svg",
    "svg": "<svg xmlns=\"http://www.w3.org/2000/svg\" viewBox=\"0 0 360 230\" role=\"img\" font-family=\"Nunito, ui-rounded, system-ui, sans-serif\" stroke-linecap=\"round\" stroke-linejoin=\"round\"><polygon points=\"42,176 165.9,176 79.8,84\" fill=\"#F59E0B1e\" stroke=\"#F59E0B\" stroke-width=\"2.8\" stroke-linejoin=\"round\"/><line x1=\"104\" y1=\"181\" x2=\"104\" y2=\"171\" stroke=\"#10B981\" stroke-width=\"2.2\"/><line x1=\"128.5\" y1=\"128.8\" x2=\"121.2\" y2=\"135.6\" stroke=\"#10B981\" stroke-width=\"2.2\"/><line x1=\"124.4\" y1=\"124.4\" x2=\"117.1\" y2=\"131.2\" stroke=\"#10B981\" stroke-width=\"2.2\"/><path d=\"M 62 176 A 20 20 0 0 0 49.6 157.5\" fill=\"none\" stroke=\"#0EA5E9\" stroke-width=\"2\"/><polygon points=\"212,176 335.9,176 249.8,84\" fill=\"#0EA5E91e\" stroke=\"#0EA5E9\" stroke-width=\"2.8\" stroke-linejoin=\"round\"/><line x1=\"274\" y1=\"181\" x2=\"274\" y2=\"171\" stroke=\"#10B981\" stroke-width=\"2.2\"/><line x1=\"298.5\" y1=\"128.8\" x2=\"291.2\" y2=\"135.6\" stroke=\"#10B981\" stroke-width=\"2.2\"/><line x1=\"294.4\" y1=\"124.4\" x2=\"287.1\" y2=\"131.2\" stroke=\"#10B981\" stroke-width=\"2.2\"/><path d=\"M 232 176 A 20 20 0 0 0 219.6 157.5\" fill=\"none\" stroke=\"#0EA5E9\" stroke-width=\"2\"/><text x=\"100\" y=\"206\" font-size=\"13\" font-weight=\"700\" fill=\"#F59E0B\" text-anchor=\"middle\">△ABC</text><text x=\"270\" y=\"206\" font-size=\"13\" font-weight=\"700\" fill=\"#0EA5E9\" text-anchor=\"middle\">△DEF</text><line x1=\"169\" y1=\"25\" x2=\"191\" y2=\"47\" stroke=\"#F43F5E\" stroke-width=\"3\"/><line x1=\"191\" y1=\"25\" x2=\"169\" y2=\"47\" stroke=\"#F43F5E\" stroke-width=\"3\"/><text x=\"180\" y=\"64\" font-size=\"12\" font-weight=\"700\" fill=\"#F43F5E\" text-anchor=\"middle\">the angle is not between the two sides</text></svg>",
    "alt": "Two triangles with the matching parts marked (SSA)"
  }
}
